
*** Running vivado
    with args -log zynq_interrupt_system_3_gpios_wrapper.vdi -applog -m64 -product Vivado -messageDb vivado.pb -mode batch -source zynq_interrupt_system_3_gpios_wrapper.tcl -notrace


****** Vivado v2019.1 (64-bit)
  **** SW Build 2552052 on Fri May 24 14:49:42 MDT 2019
  **** IP Build 2548770 on Fri May 24 18:01:18 MDT 2019
    ** Copyright 1986-2019 Xilinx, Inc. All Rights Reserved.

source zynq_interrupt_system_3_gpios_wrapper.tcl -notrace
INFO: [IP_Flow 19-234] Refreshing IP repositories
INFO: [IP_Flow 19-1704] No user IP repositories specified
INFO: [IP_Flow 19-2313] Loaded Vivado IP repository 'C:/Xilinx/Vivado/2019.1/data/ip'.
Command: link_design -top zynq_interrupt_system_3_gpios_wrapper -part xc7z010clg400-1
Design is defaulting to srcset: sources_1
Design is defaulting to constrset: constrs_1
INFO: [Device 21-403] Loading part xc7z010clg400-1
INFO: [Project 1-454] Reading design checkpoint 'c:/Zynq_Book/axi_timer_and_interrupts/axi_timer_and_interrupts.srcs/sources_1/bd/zynq_interrupt_system_3_gpios/ip/zynq_interrupt_system_3_gpios_axi_gpio_0_0/zynq_interrupt_system_3_gpios_axi_gpio_0_0.dcp' for cell 'zynq_interrupt_system_3_gpios_i/axi_gpio_0'
INFO: [Project 1-454] Reading design checkpoint 'c:/Zynq_Book/axi_timer_and_interrupts/axi_timer_and_interrupts.srcs/sources_1/bd/zynq_interrupt_system_3_gpios/ip/zynq_interrupt_system_3_gpios_axi_gpio_1_0/zynq_interrupt_system_3_gpios_axi_gpio_1_0.dcp' for cell 'zynq_interrupt_system_3_gpios_i/axi_gpio_1'
INFO: [Project 1-454] Reading design checkpoint 'c:/Zynq_Book/axi_timer_and_interrupts/axi_timer_and_interrupts.srcs/sources_1/bd/zynq_interrupt_system_3_gpios/ip/zynq_interrupt_system_3_gpios_axi_gpio_2_0/zynq_interrupt_system_3_gpios_axi_gpio_2_0.dcp' for cell 'zynq_interrupt_system_3_gpios_i/axi_gpio_2'
INFO: [Project 1-454] Reading design checkpoint 'c:/Zynq_Book/axi_timer_and_interrupts/axi_timer_and_interrupts.srcs/sources_1/bd/zynq_interrupt_system_3_gpios/ip/zynq_interrupt_system_3_gpios_axi_timer_0_0/zynq_interrupt_system_3_gpios_axi_timer_0_0.dcp' for cell 'zynq_interrupt_system_3_gpios_i/axi_timer_0'
INFO: [Project 1-454] Reading design checkpoint 'c:/Zynq_Book/axi_timer_and_interrupts/axi_timer_and_interrupts.srcs/sources_1/bd/zynq_interrupt_system_3_gpios/ip/zynq_interrupt_system_3_gpios_processing_system7_0_0/zynq_interrupt_system_3_gpios_processing_system7_0_0.dcp' for cell 'zynq_interrupt_system_3_gpios_i/processing_system7_0'
INFO: [Project 1-454] Reading design checkpoint 'c:/Zynq_Book/axi_timer_and_interrupts/axi_timer_and_interrupts.srcs/sources_1/bd/zynq_interrupt_system_3_gpios/ip/zynq_interrupt_system_3_gpios_rst_ps7_0_100M_0/zynq_interrupt_system_3_gpios_rst_ps7_0_100M_0.dcp' for cell 'zynq_interrupt_system_3_gpios_i/rst_ps7_0_100M'
INFO: [Project 1-454] Reading design checkpoint 'c:/Zynq_Book/axi_timer_and_interrupts/axi_timer_and_interrupts.srcs/sources_1/bd/zynq_interrupt_system_3_gpios/ip/zynq_interrupt_system_3_gpios_xbar_0/zynq_interrupt_system_3_gpios_xbar_0.dcp' for cell 'zynq_interrupt_system_3_gpios_i/ps7_0_axi_periph/xbar'
INFO: [Project 1-454] Reading design checkpoint 'c:/Zynq_Book/axi_timer_and_interrupts/axi_timer_and_interrupts.srcs/sources_1/bd/zynq_interrupt_system_3_gpios/ip/zynq_interrupt_system_3_gpios_auto_pc_0/zynq_interrupt_system_3_gpios_auto_pc_0.dcp' for cell 'zynq_interrupt_system_3_gpios_i/ps7_0_axi_periph/s00_couplers/auto_pc'
INFO: [Netlist 29-17] Analyzing 66 Unisim elements for replacement
INFO: [Netlist 29-28] Unisim Transformation completed in 0 CPU seconds
INFO: [Project 1-479] Netlist was created with Vivado 2019.1
INFO: [Project 1-570] Preparing netlist for logic optimization
Parsing XDC File [c:/Zynq_Book/axi_timer_and_interrupts/axi_timer_and_interrupts.srcs/sources_1/bd/zynq_interrupt_system_3_gpios/ip/zynq_interrupt_system_3_gpios_axi_gpio_0_0/zynq_interrupt_system_3_gpios_axi_gpio_0_0_board.xdc] for cell 'zynq_interrupt_system_3_gpios_i/axi_gpio_0/U0'
Finished Parsing XDC File [c:/Zynq_Book/axi_timer_and_interrupts/axi_timer_and_interrupts.srcs/sources_1/bd/zynq_interrupt_system_3_gpios/ip/zynq_interrupt_system_3_gpios_axi_gpio_0_0/zynq_interrupt_system_3_gpios_axi_gpio_0_0_board.xdc] for cell 'zynq_interrupt_system_3_gpios_i/axi_gpio_0/U0'
Parsing XDC File [c:/Zynq_Book/axi_timer_and_interrupts/axi_timer_and_interrupts.srcs/sources_1/bd/zynq_interrupt_system_3_gpios/ip/zynq_interrupt_system_3_gpios_axi_gpio_0_0/zynq_interrupt_system_3_gpios_axi_gpio_0_0.xdc] for cell 'zynq_interrupt_system_3_gpios_i/axi_gpio_0/U0'
Finished Parsing XDC File [c:/Zynq_Book/axi_timer_and_interrupts/axi_timer_and_interrupts.srcs/sources_1/bd/zynq_interrupt_system_3_gpios/ip/zynq_interrupt_system_3_gpios_axi_gpio_0_0/zynq_interrupt_system_3_gpios_axi_gpio_0_0.xdc] for cell 'zynq_interrupt_system_3_gpios_i/axi_gpio_0/U0'
Parsing XDC File [c:/Zynq_Book/axi_timer_and_interrupts/axi_timer_and_interrupts.srcs/sources_1/bd/zynq_interrupt_system_3_gpios/ip/zynq_interrupt_system_3_gpios_axi_gpio_1_0/zynq_interrupt_system_3_gpios_axi_gpio_1_0_board.xdc] for cell 'zynq_interrupt_system_3_gpios_i/axi_gpio_1/U0'
Finished Parsing XDC File [c:/Zynq_Book/axi_timer_and_interrupts/axi_timer_and_interrupts.srcs/sources_1/bd/zynq_interrupt_system_3_gpios/ip/zynq_interrupt_system_3_gpios_axi_gpio_1_0/zynq_interrupt_system_3_gpios_axi_gpio_1_0_board.xdc] for cell 'zynq_interrupt_system_3_gpios_i/axi_gpio_1/U0'
Parsing XDC File [c:/Zynq_Book/axi_timer_and_interrupts/axi_timer_and_interrupts.srcs/sources_1/bd/zynq_interrupt_system_3_gpios/ip/zynq_interrupt_system_3_gpios_axi_gpio_1_0/zynq_interrupt_system_3_gpios_axi_gpio_1_0.xdc] for cell 'zynq_interrupt_system_3_gpios_i/axi_gpio_1/U0'
Finished Parsing XDC File [c:/Zynq_Book/axi_timer_and_interrupts/axi_timer_and_interrupts.srcs/sources_1/bd/zynq_interrupt_system_3_gpios/ip/zynq_interrupt_system_3_gpios_axi_gpio_1_0/zynq_interrupt_system_3_gpios_axi_gpio_1_0.xdc] for cell 'zynq_interrupt_system_3_gpios_i/axi_gpio_1/U0'
Parsing XDC File [c:/Zynq_Book/axi_timer_and_interrupts/axi_timer_and_interrupts.srcs/sources_1/bd/zynq_interrupt_system_3_gpios/ip/zynq_interrupt_system_3_gpios_axi_timer_0_0/zynq_interrupt_system_3_gpios_axi_timer_0_0.xdc] for cell 'zynq_interrupt_system_3_gpios_i/axi_timer_0/U0'
Finished Parsing XDC File [c:/Zynq_Book/axi_timer_and_interrupts/axi_timer_and_interrupts.srcs/sources_1/bd/zynq_interrupt_system_3_gpios/ip/zynq_interrupt_system_3_gpios_axi_timer_0_0/zynq_interrupt_system_3_gpios_axi_timer_0_0.xdc] for cell 'zynq_interrupt_system_3_gpios_i/axi_timer_0/U0'
Parsing XDC File [c:/Zynq_Book/axi_timer_and_interrupts/axi_timer_and_interrupts.srcs/sources_1/bd/zynq_interrupt_system_3_gpios/ip/zynq_interrupt_system_3_gpios_processing_system7_0_0/zynq_interrupt_system_3_gpios_processing_system7_0_0.xdc] for cell 'zynq_interrupt_system_3_gpios_i/processing_system7_0/inst'
Finished Parsing XDC File [c:/Zynq_Book/axi_timer_and_interrupts/axi_timer_and_interrupts.srcs/sources_1/bd/zynq_interrupt_system_3_gpios/ip/zynq_interrupt_system_3_gpios_processing_system7_0_0/zynq_interrupt_system_3_gpios_processing_system7_0_0.xdc] for cell 'zynq_interrupt_system_3_gpios_i/processing_system7_0/inst'
Parsing XDC File [c:/Zynq_Book/axi_timer_and_interrupts/axi_timer_and_interrupts.srcs/sources_1/bd/zynq_interrupt_system_3_gpios/ip/zynq_interrupt_system_3_gpios_rst_ps7_0_100M_0/zynq_interrupt_system_3_gpios_rst_ps7_0_100M_0_board.xdc] for cell 'zynq_interrupt_system_3_gpios_i/rst_ps7_0_100M/U0'
Finished Parsing XDC File [c:/Zynq_Book/axi_timer_and_interrupts/axi_timer_and_interrupts.srcs/sources_1/bd/zynq_interrupt_system_3_gpios/ip/zynq_interrupt_system_3_gpios_rst_ps7_0_100M_0/zynq_interrupt_system_3_gpios_rst_ps7_0_100M_0_board.xdc] for cell 'zynq_interrupt_system_3_gpios_i/rst_ps7_0_100M/U0'
Parsing XDC File [c:/Zynq_Book/axi_timer_and_interrupts/axi_timer_and_interrupts.srcs/sources_1/bd/zynq_interrupt_system_3_gpios/ip/zynq_interrupt_system_3_gpios_rst_ps7_0_100M_0/zynq_interrupt_system_3_gpios_rst_ps7_0_100M_0.xdc] for cell 'zynq_interrupt_system_3_gpios_i/rst_ps7_0_100M/U0'
Finished Parsing XDC File [c:/Zynq_Book/axi_timer_and_interrupts/axi_timer_and_interrupts.srcs/sources_1/bd/zynq_interrupt_system_3_gpios/ip/zynq_interrupt_system_3_gpios_rst_ps7_0_100M_0/zynq_interrupt_system_3_gpios_rst_ps7_0_100M_0.xdc] for cell 'zynq_interrupt_system_3_gpios_i/rst_ps7_0_100M/U0'
Parsing XDC File [c:/Zynq_Book/axi_timer_and_interrupts/axi_timer_and_interrupts.srcs/sources_1/bd/zynq_interrupt_system_3_gpios/ip/zynq_interrupt_system_3_gpios_axi_gpio_2_0/zynq_interrupt_system_3_gpios_axi_gpio_2_0_board.xdc] for cell 'zynq_interrupt_system_3_gpios_i/axi_gpio_2/U0'
Finished Parsing XDC File [c:/Zynq_Book/axi_timer_and_interrupts/axi_timer_and_interrupts.srcs/sources_1/bd/zynq_interrupt_system_3_gpios/ip/zynq_interrupt_system_3_gpios_axi_gpio_2_0/zynq_interrupt_system_3_gpios_axi_gpio_2_0_board.xdc] for cell 'zynq_interrupt_system_3_gpios_i/axi_gpio_2/U0'
Parsing XDC File [c:/Zynq_Book/axi_timer_and_interrupts/axi_timer_and_interrupts.srcs/sources_1/bd/zynq_interrupt_system_3_gpios/ip/zynq_interrupt_system_3_gpios_axi_gpio_2_0/zynq_interrupt_system_3_gpios_axi_gpio_2_0.xdc] for cell 'zynq_interrupt_system_3_gpios_i/axi_gpio_2/U0'
Finished Parsing XDC File [c:/Zynq_Book/axi_timer_and_interrupts/axi_timer_and_interrupts.srcs/sources_1/bd/zynq_interrupt_system_3_gpios/ip/zynq_interrupt_system_3_gpios_axi_gpio_2_0/zynq_interrupt_system_3_gpios_axi_gpio_2_0.xdc] for cell 'zynq_interrupt_system_3_gpios_i/axi_gpio_2/U0'
INFO: [Opt 31-138] Pushed 0 inverter(s) to 0 load pin(s).
Netlist sorting complete. Time (s): cpu = 00:00:00 ; elapsed = 00:00:00.003 . Memory (MB): peak = 714.840 ; gain = 0.000
INFO: [Project 1-111] Unisim Transformation Summary:
No Unisim elements were transformed.

18 Infos, 0 Warnings, 0 Critical Warnings and 0 Errors encountered.
link_design completed successfully
link_design: Time (s): cpu = 00:00:13 ; elapsed = 00:00:19 . Memory (MB): peak = 714.840 ; gain = 406.148
Command: opt_design
Attempting to get a license for feature 'Implementation' and/or device 'xc7z010'
INFO: [Common 17-349] Got license for feature 'Implementation' and/or device 'xc7z010'
Running DRC as a precondition to command opt_design

Starting DRC Task
INFO: [DRC 23-27] Running DRC with 2 threads
INFO: [Project 1-461] DRC finished with 0 Errors
INFO: [Project 1-462] Please refer to the DRC report (report_drc) for more information.

Time (s): cpu = 00:00:02 ; elapsed = 00:00:01 . Memory (MB): peak = 735.848 ; gain = 21.008

Starting Cache Timing Information Task
INFO: [Timing 38-35] Done setting XDC timing constraints.
Ending Cache Timing Information Task | Checksum: 13e27dd56

Time (s): cpu = 00:00:14 ; elapsed = 00:00:15 . Memory (MB): peak = 1269.738 ; gain = 533.891

Starting Logic Optimization Task

Phase 1 Retarget
INFO: [Opt 31-138] Pushed 0 inverter(s) to 0 load pin(s).
INFO: [Opt 31-49] Retargeted 0 cell(s).
Phase 1 Retarget | Checksum: 11ffaa31c

Time (s): cpu = 00:00:00 ; elapsed = 00:00:00.368 . Memory (MB): peak = 1407.613 ; gain = 0.000
INFO: [Opt 31-389] Phase Retarget created 6 cells and removed 65 cells
INFO: [Opt 31-1021] In phase Retarget, 8 netlist objects are constrained preventing optimization. Please run opt_design with -debug_log to get more detail. 

Phase 2 Constant propagation
INFO: [Opt 31-138] Pushed 0 inverter(s) to 0 load pin(s).
Phase 2 Constant propagation | Checksum: 126a8b0a1

Time (s): cpu = 00:00:00 ; elapsed = 00:00:00.438 . Memory (MB): peak = 1407.613 ; gain = 0.000
INFO: [Opt 31-389] Phase Constant propagation created 4 cells and removed 8 cells

Phase 3 Sweep
Phase 3 Sweep | Checksum: 156caf2fc

Time (s): cpu = 00:00:01 ; elapsed = 00:00:01 . Memory (MB): peak = 1407.613 ; gain = 0.000
INFO: [Opt 31-389] Phase Sweep created 4 cells and removed 197 cells

Phase 4 BUFG optimization
Phase 4 BUFG optimization | Checksum: 156caf2fc

Time (s): cpu = 00:00:01 ; elapsed = 00:00:01 . Memory (MB): peak = 1407.613 ; gain = 0.000
INFO: [Opt 31-662] Phase BUFG optimization created 0 cells of which 0 are BUFGs and removed 0 cells.

Phase 5 Shift Register Optimization
INFO: [Opt 31-1064] SRL Remap converted 0 SRLs to 0 registers and converted 0 registers of register chains to 0 SRLs
Phase 5 Shift Register Optimization | Checksum: 156caf2fc

Time (s): cpu = 00:00:01 ; elapsed = 00:00:01 . Memory (MB): peak = 1407.613 ; gain = 0.000
INFO: [Opt 31-389] Phase Shift Register Optimization created 0 cells and removed 0 cells

Phase 6 Post Processing Netlist
Phase 6 Post Processing Netlist | Checksum: 1a3bed772

Time (s): cpu = 00:00:01 ; elapsed = 00:00:01 . Memory (MB): peak = 1407.613 ; gain = 0.000
INFO: [Opt 31-389] Phase Post Processing Netlist created 0 cells and removed 0 cells
Opt_design Change Summary
=========================


-------------------------------------------------------------------------------------------------------------------------
|  Phase                        |  #Cells created  |  #Cells Removed  |  #Constrained objects preventing optimizations  |
-------------------------------------------------------------------------------------------------------------------------
|  Retarget                     |               6  |              65  |                                              8  |
|  Constant propagation         |               4  |               8  |                                              0  |
|  Sweep                        |               4  |             197  |                                              0  |
|  BUFG optimization            |               0  |               0  |                                              0  |
|  Shift Register Optimization  |               0  |               0  |                                              0  |
|  Post Processing Netlist      |               0  |               0  |                                              0  |
-------------------------------------------------------------------------------------------------------------------------



Starting Connectivity Check Task

Time (s): cpu = 00:00:00 ; elapsed = 00:00:00.010 . Memory (MB): peak = 1407.613 ; gain = 0.000
Ending Logic Optimization Task | Checksum: 1582e0ea4

Time (s): cpu = 00:00:02 ; elapsed = 00:00:02 . Memory (MB): peak = 1407.613 ; gain = 0.000

Starting Power Optimization Task
INFO: [Pwropt 34-132] Skipping clock gating for clocks with a period < 2.00 ns.
Ending Power Optimization Task | Checksum: 1582e0ea4

Time (s): cpu = 00:00:00 ; elapsed = 00:00:00.033 . Memory (MB): peak = 1407.613 ; gain = 0.000

Starting Final Cleanup Task
Ending Final Cleanup Task | Checksum: 1582e0ea4

Time (s): cpu = 00:00:00 ; elapsed = 00:00:00 . Memory (MB): peak = 1407.613 ; gain = 0.000

Starting Netlist Obfuscation Task
Netlist sorting complete. Time (s): cpu = 00:00:00 ; elapsed = 00:00:00.002 . Memory (MB): peak = 1407.613 ; gain = 0.000
Ending Netlist Obfuscation Task | Checksum: 1582e0ea4

Time (s): cpu = 00:00:00 ; elapsed = 00:00:00.003 . Memory (MB): peak = 1407.613 ; gain = 0.000
INFO: [Common 17-83] Releasing license: Implementation
36 Infos, 0 Warnings, 0 Critical Warnings and 0 Errors encountered.
opt_design completed successfully
opt_design: Time (s): cpu = 00:00:20 ; elapsed = 00:00:20 . Memory (MB): peak = 1407.613 ; gain = 692.773
Netlist sorting complete. Time (s): cpu = 00:00:00 ; elapsed = 00:00:00.005 . Memory (MB): peak = 1407.613 ; gain = 0.000
INFO: [Timing 38-480] Writing timing data to binary archive.
Writing placer database...
Writing XDEF routing.
Writing XDEF routing logical nets.
Writing XDEF routing special nets.
Write XDEF Complete: Time (s): cpu = 00:00:00 ; elapsed = 00:00:00.181 . Memory (MB): peak = 1407.613 ; gain = 0.000
INFO: [Common 17-1381] The checkpoint 'C:/Zynq_Book/axi_timer_and_interrupts/axi_timer_and_interrupts.runs/impl_1/zynq_interrupt_system_3_gpios_wrapper_opt.dcp' has been generated.
INFO: [runtcl-4] Executing : report_drc -file zynq_interrupt_system_3_gpios_wrapper_drc_opted.rpt -pb zynq_interrupt_system_3_gpios_wrapper_drc_opted.pb -rpx zynq_interrupt_system_3_gpios_wrapper_drc_opted.rpx
Command: report_drc -file zynq_interrupt_system_3_gpios_wrapper_drc_opted.rpt -pb zynq_interrupt_system_3_gpios_wrapper_drc_opted.pb -rpx zynq_interrupt_system_3_gpios_wrapper_drc_opted.rpx
INFO: [IP_Flow 19-1839] IP Catalog is up to date.
INFO: [DRC 23-27] Running DRC with 2 threads
INFO: [Coretcl 2-168] The results of DRC are in file C:/Zynq_Book/axi_timer_and_interrupts/axi_timer_and_interrupts.runs/impl_1/zynq_interrupt_system_3_gpios_wrapper_drc_opted.rpt.
report_drc completed successfully
Command: place_design
Attempting to get a license for feature 'Implementation' and/or device 'xc7z010'
INFO: [Common 17-349] Got license for feature 'Implementation' and/or device 'xc7z010'
INFO: [DRC 23-27] Running DRC with 2 threads
INFO: [Vivado_Tcl 4-198] DRC finished with 0 Errors
INFO: [Vivado_Tcl 4-199] Please refer to the DRC report (report_drc) for more information.
Running DRC as a precondition to command place_design
INFO: [DRC 23-27] Running DRC with 2 threads
INFO: [Vivado_Tcl 4-198] DRC finished with 0 Errors
INFO: [Vivado_Tcl 4-199] Please refer to the DRC report (report_drc) for more information.

Starting Placer Task
INFO: [Place 30-611] Multithreading enabled for place_design using a maximum of 2 CPUs

Phase 1 Placer Initialization

Phase 1.1 Placer Initialization Netlist Sorting
Netlist sorting complete. Time (s): cpu = 00:00:00 ; elapsed = 00:00:00.009 . Memory (MB): peak = 1407.613 ; gain = 0.000
Phase 1.1 Placer Initialization Netlist Sorting | Checksum: 13eaeb3d3

Time (s): cpu = 00:00:00 ; elapsed = 00:00:00.033 . Memory (MB): peak = 1407.613 ; gain = 0.000
Netlist sorting complete. Time (s): cpu = 00:00:00 ; elapsed = 00:00:00.004 . Memory (MB): peak = 1407.613 ; gain = 0.000

Phase 1.2 IO Placement/ Clock Placement/ Build Placer Device
INFO: [Timing 38-35] Done setting XDC timing constraints.
Phase 1.2 IO Placement/ Clock Placement/ Build Placer Device | Checksum: 1401670d8

Time (s): cpu = 00:00:02 ; elapsed = 00:00:03 . Memory (MB): peak = 1407.613 ; gain = 0.000

Phase 1.3 Build Placer Netlist Model
Phase 1.3 Build Placer Netlist Model | Checksum: 26ac564a4

Time (s): cpu = 00:00:03 ; elapsed = 00:00:04 . Memory (MB): peak = 1407.613 ; gain = 0.000

Phase 1.4 Constrain Clocks/Macros
Phase 1.4 Constrain Clocks/Macros | Checksum: 26ac564a4

Time (s): cpu = 00:00:03 ; elapsed = 00:00:04 . Memory (MB): peak = 1407.613 ; gain = 0.000
Phase 1 Placer Initialization | Checksum: 26ac564a4

Time (s): cpu = 00:00:03 ; elapsed = 00:00:04 . Memory (MB): peak = 1407.613 ; gain = 0.000

Phase 2 Global Placement

Phase 2.1 Floorplanning
Phase 2.1 Floorplanning | Checksum: 2ae99c6b4

Time (s): cpu = 00:00:04 ; elapsed = 00:00:04 . Memory (MB): peak = 1407.613 ; gain = 0.000

Phase 2.2 Global Placement Core

Phase 2.2.1 Physical Synthesis In Placer
INFO: [Physopt 32-65] No nets found for high-fanout optimization.
INFO: [Physopt 32-232] Optimized 0 net. Created 0 new instance.
INFO: [Physopt 32-775] End 1 Pass. Optimized 0 net or cell. Created 0 new cell, deleted 0 existing cell and moved 0 existing cell
INFO: [Physopt 32-670] No setup violation found.  DSP Register Optimization was not performed.
INFO: [Physopt 32-670] No setup violation found.  Shift Register Optimization was not performed.
INFO: [Physopt 32-670] No setup violation found.  BRAM Register Optimization was not performed.
INFO: [Physopt 32-949] No candidate nets found for HD net replication
INFO: [Physopt 32-775] End 1 Pass. Optimized 0 net or cell. Created 0 new cell, deleted 0 existing cell and moved 0 existing cell
Netlist sorting complete. Time (s): cpu = 00:00:00 ; elapsed = 00:00:00.002 . Memory (MB): peak = 1407.613 ; gain = 0.000

Summary of Physical Synthesis Optimizations
============================================


----------------------------------------------------------------------------------------------------------------------------------------
|  Optimization                  |  Added Cells  |  Removed Cells  |  Optimized Cells/Nets  |  Dont Touch  |  Iterations  |  Elapsed   |
----------------------------------------------------------------------------------------------------------------------------------------
|  Very High Fanout              |            0  |              0  |                     0  |           0  |           1  |  00:00:00  |
|  DSP Register                  |            0  |              0  |                     0  |           0  |           0  |  00:00:00  |
|  Shift Register                |            0  |              0  |                     0  |           0  |           0  |  00:00:00  |
|  BRAM Register                 |            0  |              0  |                     0  |           0  |           0  |  00:00:00  |
|  HD Interface Net Replication  |            0  |              0  |                     0  |           0  |           1  |  00:00:00  |
|  Total                         |            0  |              0  |                     0  |           0  |           2  |  00:00:00  |
----------------------------------------------------------------------------------------------------------------------------------------


Phase 2.2.1 Physical Synthesis In Placer | Checksum: 1e2c69146

Time (s): cpu = 00:00:09 ; elapsed = 00:00:08 . Memory (MB): peak = 1407.613 ; gain = 0.000
Phase 2.2 Global Placement Core | Checksum: 1e0837320

Time (s): cpu = 00:00:09 ; elapsed = 00:00:08 . Memory (MB): peak = 1407.613 ; gain = 0.000
Phase 2 Global Placement | Checksum: 1e0837320

Time (s): cpu = 00:00:09 ; elapsed = 00:00:08 . Memory (MB): peak = 1407.613 ; gain = 0.000

Phase 3 Detail Placement

Phase 3.1 Commit Multi Column Macros
Phase 3.1 Commit Multi Column Macros | Checksum: 211b47901

Time (s): cpu = 00:00:10 ; elapsed = 00:00:08 . Memory (MB): peak = 1407.613 ; gain = 0.000

Phase 3.2 Commit Most Macros & LUTRAMs
Phase 3.2 Commit Most Macros & LUTRAMs | Checksum: 1f8ed1e11

Time (s): cpu = 00:00:10 ; elapsed = 00:00:09 . Memory (MB): peak = 1407.613 ; gain = 0.000

Phase 3.3 Area Swap Optimization
Phase 3.3 Area Swap Optimization | Checksum: 25c6bda05

Time (s): cpu = 00:00:11 ; elapsed = 00:00:09 . Memory (MB): peak = 1407.613 ; gain = 0.000

Phase 3.4 Pipeline Register Optimization
Phase 3.4 Pipeline Register Optimization | Checksum: 26f896c59

Time (s): cpu = 00:00:11 ; elapsed = 00:00:09 . Memory (MB): peak = 1407.613 ; gain = 0.000

Phase 3.5 Small Shape Detail Placement
Phase 3.5 Small Shape Detail Placement | Checksum: 23b2ded74

Time (s): cpu = 00:00:12 ; elapsed = 00:00:10 . Memory (MB): peak = 1407.613 ; gain = 0.000

Phase 3.6 Re-assign LUT pins
Phase 3.6 Re-assign LUT pins | Checksum: 1836235c9

Time (s): cpu = 00:00:12 ; elapsed = 00:00:10 . Memory (MB): peak = 1407.613 ; gain = 0.000

Phase 3.7 Pipeline Register Optimization
Phase 3.7 Pipeline Register Optimization | Checksum: 194485ff5

Time (s): cpu = 00:00:12 ; elapsed = 00:00:10 . Memory (MB): peak = 1407.613 ; gain = 0.000
Phase 3 Detail Placement | Checksum: 194485ff5

Time (s): cpu = 00:00:12 ; elapsed = 00:00:10 . Memory (MB): peak = 1407.613 ; gain = 0.000

Phase 4 Post Placement Optimization and Clean-Up

Phase 4.1 Post Commit Optimization
INFO: [Timing 38-35] Done setting XDC timing constraints.

Phase 4.1.1 Post Placement Optimization
Post Placement Optimization Initialization | Checksum: 875cc122

Phase 4.1.1.1 BUFG Insertion
INFO: [Place 46-56] BUFG insertion identified 0 candidate nets. Inserted BUFG: 0, Replicated BUFG Driver: 0, Skipped due to Placement/Routing Conflicts: 0, Skipped due to Timing Degradation: 0, Skipped due to Illegal Netlist: 0.
Phase 4.1.1.1 BUFG Insertion | Checksum: 875cc122

Time (s): cpu = 00:00:13 ; elapsed = 00:00:11 . Memory (MB): peak = 1410.293 ; gain = 2.680
INFO: [Place 30-746] Post Placement Timing Summary WNS=3.297. For the most accurate timing information please run report_timing.
Phase 4.1.1 Post Placement Optimization | Checksum: 12f9034d8

Time (s): cpu = 00:00:13 ; elapsed = 00:00:11 . Memory (MB): peak = 1410.293 ; gain = 2.680
Phase 4.1 Post Commit Optimization | Checksum: 12f9034d8

Time (s): cpu = 00:00:13 ; elapsed = 00:00:11 . Memory (MB): peak = 1410.293 ; gain = 2.680

Phase 4.2 Post Placement Cleanup
Phase 4.2 Post Placement Cleanup | Checksum: 12f9034d8

Time (s): cpu = 00:00:13 ; elapsed = 00:00:11 . Memory (MB): peak = 1410.293 ; gain = 2.680

Phase 4.3 Placer Reporting
Phase 4.3 Placer Reporting | Checksum: 12f9034d8

Time (s): cpu = 00:00:13 ; elapsed = 00:00:11 . Memory (MB): peak = 1410.293 ; gain = 2.680

Phase 4.4 Final Placement Cleanup
Netlist sorting complete. Time (s): cpu = 00:00:00 ; elapsed = 00:00:00.004 . Memory (MB): peak = 1410.293 ; gain = 0.000
Phase 4.4 Final Placement Cleanup | Checksum: 144e4a489

Time (s): cpu = 00:00:13 ; elapsed = 00:00:11 . Memory (MB): peak = 1410.293 ; gain = 2.680
Phase 4 Post Placement Optimization and Clean-Up | Checksum: 144e4a489

Time (s): cpu = 00:00:13 ; elapsed = 00:00:11 . Memory (MB): peak = 1410.293 ; gain = 2.680
Ending Placer Task | Checksum: 837a079b

Time (s): cpu = 00:00:13 ; elapsed = 00:00:11 . Memory (MB): peak = 1410.293 ; gain = 2.680
INFO: [Common 17-83] Releasing license: Implementation
63 Infos, 0 Warnings, 0 Critical Warnings and 0 Errors encountered.
place_design completed successfully
place_design: Time (s): cpu = 00:00:16 ; elapsed = 00:00:14 . Memory (MB): peak = 1410.293 ; gain = 2.680
Netlist sorting complete. Time (s): cpu = 00:00:00 ; elapsed = 00:00:00.005 . Memory (MB): peak = 1410.293 ; gain = 0.000
INFO: [Timing 38-480] Writing timing data to binary archive.
Writing placer database...
Writing XDEF routing.
Writing XDEF routing logical nets.
Writing XDEF routing special nets.
Write XDEF Complete: Time (s): cpu = 00:00:02 ; elapsed = 00:00:00.682 . Memory (MB): peak = 1411.258 ; gain = 0.965
INFO: [Common 17-1381] The checkpoint 'C:/Zynq_Book/axi_timer_and_interrupts/axi_timer_and_interrupts.runs/impl_1/zynq_interrupt_system_3_gpios_wrapper_placed.dcp' has been generated.
INFO: [runtcl-4] Executing : report_io -file zynq_interrupt_system_3_gpios_wrapper_io_placed.rpt
report_io: Time (s): cpu = 00:00:00 ; elapsed = 00:00:00.101 . Memory (MB): peak = 1411.258 ; gain = 0.000
INFO: [runtcl-4] Executing : report_utilization -file zynq_interrupt_system_3_gpios_wrapper_utilization_placed.rpt -pb zynq_interrupt_system_3_gpios_wrapper_utilization_placed.pb
INFO: [runtcl-4] Executing : report_control_sets -verbose -file zynq_interrupt_system_3_gpios_wrapper_control_sets_placed.rpt
report_control_sets: Time (s): cpu = 00:00:00 ; elapsed = 00:00:00.096 . Memory (MB): peak = 1411.258 ; gain = 0.000
Command: route_design
Attempting to get a license for feature 'Implementation' and/or device 'xc7z010'
INFO: [Common 17-349] Got license for feature 'Implementation' and/or device 'xc7z010'
Running DRC as a precondition to command route_design
INFO: [DRC 23-27] Running DRC with 2 threads
INFO: [Vivado_Tcl 4-198] DRC finished with 0 Errors
INFO: [Vivado_Tcl 4-199] Please refer to the DRC report (report_drc) for more information.


Starting Routing Task
INFO: [Route 35-254] Multithreading enabled for route_design using a maximum of 2 CPUs
Checksum: PlaceDB: 472c261b ConstDB: 0 ShapeSum: 3c4de180 RouteDB: 0

Phase 1 Build RT Design
Phase 1 Build RT Design | Checksum: 1b997c6f5

Time (s): cpu = 00:00:22 ; elapsed = 00:00:20 . Memory (MB): peak = 1456.152 ; gain = 29.824
Post Restoration Checksum: NetGraph: d0ce3d82 NumContArr: e8c98973 Constraints: 0 Timing: 0

Phase 2 Router Initialization

Phase 2.1 Create Timer
Phase 2.1 Create Timer | Checksum: 1b997c6f5

Time (s): cpu = 00:00:22 ; elapsed = 00:00:20 . Memory (MB): peak = 1484.449 ; gain = 58.121

Phase 2.2 Fix Topology Constraints
Phase 2.2 Fix Topology Constraints | Checksum: 1b997c6f5

Time (s): cpu = 00:00:22 ; elapsed = 00:00:20 . Memory (MB): peak = 1490.473 ; gain = 64.145

Phase 2.3 Pre Route Cleanup
Phase 2.3 Pre Route Cleanup | Checksum: 1b997c6f5

Time (s): cpu = 00:00:22 ; elapsed = 00:00:20 . Memory (MB): peak = 1490.473 ; gain = 64.145
 Number of Nodes with overlaps = 0

Phase 2.4 Update Timing
Phase 2.4 Update Timing | Checksum: 19b07ca09

Time (s): cpu = 00:00:23 ; elapsed = 00:00:21 . Memory (MB): peak = 1497.223 ; gain = 70.895
INFO: [Route 35-416] Intermediate Timing Summary | WNS=3.321  | TNS=0.000  | WHS=-0.174 | THS=-26.825|

Phase 2 Router Initialization | Checksum: 17ee20b95

Time (s): cpu = 00:00:23 ; elapsed = 00:00:21 . Memory (MB): peak = 1500.773 ; gain = 74.445

Router Utilization Summary
  Global Vertical Routing Utilization    = 0 %
  Global Horizontal Routing Utilization  = 0 %
  Routable Net Status*
  *Does not include unroutable nets such as driverless and loadless.
  Run report_route_status for detailed report.
  Number of Failed Nets               = 2043
    (Failed Nets is the sum of unrouted and partially routed nets)
  Number of Unrouted Nets             = 2043
  Number of Partially Routed Nets     = 0
  Number of Node Overlaps             = 0


Phase 3 Initial Routing
Phase 3 Initial Routing | Checksum: 190ea35a6

Time (s): cpu = 00:00:24 ; elapsed = 00:00:22 . Memory (MB): peak = 1500.809 ; gain = 74.480

Phase 4 Rip-up And Reroute

Phase 4.1 Global Iteration 0
 Number of Nodes with overlaps = 163
 Number of Nodes with overlaps = 4
 Number of Nodes with overlaps = 0
INFO: [Route 35-416] Intermediate Timing Summary | WNS=3.299  | TNS=0.000  | WHS=N/A    | THS=N/A    |

Phase 4.1 Global Iteration 0 | Checksum: 11f557841

Time (s): cpu = 00:00:26 ; elapsed = 00:00:23 . Memory (MB): peak = 1500.809 ; gain = 74.480

Phase 4.2 Global Iteration 1
 Number of Nodes with overlaps = 0
INFO: [Route 35-416] Intermediate Timing Summary | WNS=3.299  | TNS=0.000  | WHS=N/A    | THS=N/A    |

Phase 4.2 Global Iteration 1 | Checksum: 22fe8f3df

Time (s): cpu = 00:00:26 ; elapsed = 00:00:23 . Memory (MB): peak = 1500.809 ; gain = 74.480
Phase 4 Rip-up And Reroute | Checksum: 22fe8f3df

Time (s): cpu = 00:00:26 ; elapsed = 00:00:23 . Memory (MB): peak = 1500.809 ; gain = 74.480

Phase 5 Delay and Skew Optimization

Phase 5.1 Delay CleanUp
Phase 5.1 Delay CleanUp | Checksum: 22fe8f3df

Time (s): cpu = 00:00:26 ; elapsed = 00:00:23 . Memory (MB): peak = 1500.809 ; gain = 74.480

Phase 5.2 Clock Skew Optimization
Phase 5.2 Clock Skew Optimization | Checksum: 22fe8f3df

Time (s): cpu = 00:00:26 ; elapsed = 00:00:23 . Memory (MB): peak = 1500.809 ; gain = 74.480
Phase 5 Delay and Skew Optimization | Checksum: 22fe8f3df

Time (s): cpu = 00:00:26 ; elapsed = 00:00:23 . Memory (MB): peak = 1500.809 ; gain = 74.480

Phase 6 Post Hold Fix

Phase 6.1 Hold Fix Iter

Phase 6.1.1 Update Timing
Phase 6.1.1 Update Timing | Checksum: 1eb72ecf4

Time (s): cpu = 00:00:26 ; elapsed = 00:00:23 . Memory (MB): peak = 1500.809 ; gain = 74.480
INFO: [Route 35-416] Intermediate Timing Summary | WNS=3.414  | TNS=0.000  | WHS=0.005  | THS=0.000  |

Phase 6.1 Hold Fix Iter | Checksum: 164993a12

Time (s): cpu = 00:00:26 ; elapsed = 00:00:23 . Memory (MB): peak = 1500.809 ; gain = 74.480
Phase 6 Post Hold Fix | Checksum: 164993a12

Time (s): cpu = 00:00:26 ; elapsed = 00:00:23 . Memory (MB): peak = 1500.809 ; gain = 74.480

Phase 7 Route finalize

Router Utilization Summary
  Global Vertical Routing Utilization    = 0.765062 %
  Global Horizontal Routing Utilization  = 1.05538 %
  Routable Net Status*
  *Does not include unroutable nets such as driverless and loadless.
  Run report_route_status for detailed report.
  Number of Failed Nets               = 0
    (Failed Nets is the sum of unrouted and partially routed nets)
  Number of Unrouted Nets             = 0
  Number of Partially Routed Nets     = 0
  Number of Node Overlaps             = 0

Phase 7 Route finalize | Checksum: 173349720

Time (s): cpu = 00:00:26 ; elapsed = 00:00:23 . Memory (MB): peak = 1500.809 ; gain = 74.480

Phase 8 Verifying routed nets

 Verification completed successfully
Phase 8 Verifying routed nets | Checksum: 173349720

Time (s): cpu = 00:00:26 ; elapsed = 00:00:23 . Memory (MB): peak = 1502.867 ; gain = 76.539

Phase 9 Depositing Routes
Phase 9 Depositing Routes | Checksum: 1543181de

Time (s): cpu = 00:00:26 ; elapsed = 00:00:24 . Memory (MB): peak = 1502.867 ; gain = 76.539

Phase 10 Post Router Timing
INFO: [Route 35-57] Estimated Timing Summary | WNS=3.414  | TNS=0.000  | WHS=0.005  | THS=0.000  |

INFO: [Route 35-327] The final timing numbers are based on the router estimated timing analysis. For a complete and accurate timing signoff, please run report_timing_summary.
Phase 10 Post Router Timing | Checksum: 1543181de

Time (s): cpu = 00:00:26 ; elapsed = 00:00:24 . Memory (MB): peak = 1502.867 ; gain = 76.539
INFO: [Route 35-16] Router Completed Successfully

Time (s): cpu = 00:00:26 ; elapsed = 00:00:24 . Memory (MB): peak = 1502.867 ; gain = 76.539

Routing Is Done.
INFO: [Common 17-83] Releasing license: Implementation
81 Infos, 0 Warnings, 0 Critical Warnings and 0 Errors encountered.
route_design completed successfully
route_design: Time (s): cpu = 00:00:30 ; elapsed = 00:00:26 . Memory (MB): peak = 1502.867 ; gain = 91.609
Netlist sorting complete. Time (s): cpu = 00:00:00 ; elapsed = 00:00:00.004 . Memory (MB): peak = 1502.867 ; gain = 0.000
INFO: [Timing 38-480] Writing timing data to binary archive.
Writing placer database...
Writing XDEF routing.
Writing XDEF routing logical nets.
Writing XDEF routing special nets.
Write XDEF Complete: Time (s): cpu = 00:00:02 ; elapsed = 00:00:00.768 . Memory (MB): peak = 1513.320 ; gain = 10.453
INFO: [Common 17-1381] The checkpoint 'C:/Zynq_Book/axi_timer_and_interrupts/axi_timer_and_interrupts.runs/impl_1/zynq_interrupt_system_3_gpios_wrapper_routed.dcp' has been generated.
INFO: [runtcl-4] Executing : report_drc -file zynq_interrupt_system_3_gpios_wrapper_drc_routed.rpt -pb zynq_interrupt_system_3_gpios_wrapper_drc_routed.pb -rpx zynq_interrupt_system_3_gpios_wrapper_drc_routed.rpx
Command: report_drc -file zynq_interrupt_system_3_gpios_wrapper_drc_routed.rpt -pb zynq_interrupt_system_3_gpios_wrapper_drc_routed.pb -rpx zynq_interrupt_system_3_gpios_wrapper_drc_routed.rpx
INFO: [IP_Flow 19-1839] IP Catalog is up to date.
INFO: [DRC 23-27] Running DRC with 2 threads
INFO: [Coretcl 2-168] The results of DRC are in file C:/Zynq_Book/axi_timer_and_interrupts/axi_timer_and_interrupts.runs/impl_1/zynq_interrupt_system_3_gpios_wrapper_drc_routed.rpt.
report_drc completed successfully
INFO: [runtcl-4] Executing : report_methodology -file zynq_interrupt_system_3_gpios_wrapper_methodology_drc_routed.rpt -pb zynq_interrupt_system_3_gpios_wrapper_methodology_drc_routed.pb -rpx zynq_interrupt_system_3_gpios_wrapper_methodology_drc_routed.rpx
Command: report_methodology -file zynq_interrupt_system_3_gpios_wrapper_methodology_drc_routed.rpt -pb zynq_interrupt_system_3_gpios_wrapper_methodology_drc_routed.pb -rpx zynq_interrupt_system_3_gpios_wrapper_methodology_drc_routed.rpx
INFO: [Timing 38-35] Done setting XDC timing constraints.
INFO: [DRC 23-133] Running Methodology with 2 threads
INFO: [Coretcl 2-1520] The results of Report Methodology are in file C:/Zynq_Book/axi_timer_and_interrupts/axi_timer_and_interrupts.runs/impl_1/zynq_interrupt_system_3_gpios_wrapper_methodology_drc_routed.rpt.
report_methodology completed successfully
INFO: [runtcl-4] Executing : report_power -file zynq_interrupt_system_3_gpios_wrapper_power_routed.rpt -pb zynq_interrupt_system_3_gpios_wrapper_power_summary_routed.pb -rpx zynq_interrupt_system_3_gpios_wrapper_power_routed.rpx
Command: report_power -file zynq_interrupt_system_3_gpios_wrapper_power_routed.rpt -pb zynq_interrupt_system_3_gpios_wrapper_power_summary_routed.pb -rpx zynq_interrupt_system_3_gpios_wrapper_power_routed.rpx
INFO: [Timing 38-35] Done setting XDC timing constraints.
Running Vector-less Activity Propagation...

Finished Running Vector-less Activity Propagation
93 Infos, 0 Warnings, 0 Critical Warnings and 0 Errors encountered.
report_power completed successfully
INFO: [runtcl-4] Executing : report_route_status -file zynq_interrupt_system_3_gpios_wrapper_route_status.rpt -pb zynq_interrupt_system_3_gpios_wrapper_route_status.pb
INFO: [runtcl-4] Executing : report_timing_summary -max_paths 10 -file zynq_interrupt_system_3_gpios_wrapper_timing_summary_routed.rpt -pb zynq_interrupt_system_3_gpios_wrapper_timing_summary_routed.pb -rpx zynq_interrupt_system_3_gpios_wrapper_timing_summary_routed.rpx -warn_on_violation 
INFO: [Timing 38-91] UpdateTimingParams: Speed grade: -1, Delay Type: min_max.
INFO: [Timing 38-191] Multithreading enabled for timing update using a maximum of 2 CPUs
INFO: [runtcl-4] Executing : report_incremental_reuse -file zynq_interrupt_system_3_gpios_wrapper_incremental_reuse_routed.rpt
INFO: [Vivado_Tcl 4-1062] Incremental flow is disabled. No incremental reuse Info to report.
INFO: [runtcl-4] Executing : report_clock_utilization -file zynq_interrupt_system_3_gpios_wrapper_clock_utilization_routed.rpt
INFO: [runtcl-4] Executing : report_bus_skew -warn_on_violation -file zynq_interrupt_system_3_gpios_wrapper_bus_skew_routed.rpt -pb zynq_interrupt_system_3_gpios_wrapper_bus_skew_routed.pb -rpx zynq_interrupt_system_3_gpios_wrapper_bus_skew_routed.rpx
INFO: [Timing 38-91] UpdateTimingParams: Speed grade: -1, Delay Type: min_max.
INFO: [Timing 38-191] Multithreading enabled for timing update using a maximum of 2 CPUs
Command: write_bitstream -force zynq_interrupt_system_3_gpios_wrapper.bit
Attempting to get a license for feature 'Implementation' and/or device 'xc7z010'
INFO: [Common 17-349] Got license for feature 'Implementation' and/or device 'xc7z010'
Running DRC as a precondition to command write_bitstream
INFO: [IP_Flow 19-1839] IP Catalog is up to date.
INFO: [DRC 23-27] Running DRC with 2 threads
INFO: [Vivado 12-3199] DRC finished with 0 Errors
INFO: [Vivado 12-3200] Please refer to the DRC report (report_drc) for more information.
INFO: [Designutils 20-2272] Running write_bitstream with 2 threads.
Loading data files...
Loading site data...
Loading route data...
Processing options...
Creating bitmap...
Creating bitstream...
Writing bitstream ./zynq_interrupt_system_3_gpios_wrapper.bit...
INFO: [Vivado 12-1842] Bitgen Completed Successfully.
INFO: [Project 1-120] WebTalk data collection is mandatory when using a WebPACK part without a full Vivado license. To see the specific WebTalk data collected for your design, open the usage_statistics_webtalk.html or usage_statistics_webtalk.xml file in the implementation directory.
INFO: [Common 17-186] 'C:/Zynq_Book/axi_timer_and_interrupts/axi_timer_and_interrupts.runs/impl_1/usage_statistics_webtalk.xml' has been successfully sent to Xilinx on Wed Sep 23 13:58:07 2020. For additional details about this file, please refer to the WebTalk help file at C:/Xilinx/Vivado/2019.1/doc/webtalk_introduction.html.
INFO: [Common 17-83] Releasing license: Implementation
113 Infos, 0 Warnings, 0 Critical Warnings and 0 Errors encountered.
write_bitstream completed successfully
write_bitstream: Time (s): cpu = 00:00:22 ; elapsed = 00:00:24 . Memory (MB): peak = 1937.527 ; gain = 397.156
INFO: [Common 17-206] Exiting Vivado at Wed Sep 23 13:58:07 2020...

*** Running vivado
    with args -log zynq_interrupt_system_3_gpios_wrapper.vdi -applog -m64 -product Vivado -messageDb vivado.pb -mode batch -source zynq_interrupt_system_3_gpios_wrapper.tcl -notrace


****** Vivado v2019.1 (64-bit)
  **** SW Build 2552052 on Fri May 24 14:49:42 MDT 2019
  **** IP Build 2548770 on Fri May 24 18:01:18 MDT 2019
    ** Copyright 1986-2019 Xilinx, Inc. All Rights Reserved.

source zynq_interrupt_system_3_gpios_wrapper.tcl -notrace
Command: open_checkpoint zynq_interrupt_system_3_gpios_wrapper_routed.dcp

Starting open_checkpoint Task

Time (s): cpu = 00:00:00 ; elapsed = 00:00:00.121 . Memory (MB): peak = 298.570 ; gain = 0.000
INFO: [Device 21-403] Loading part xc7z010clg400-1
INFO: [Netlist 29-17] Analyzing 66 Unisim elements for replacement
INFO: [Netlist 29-28] Unisim Transformation completed in 0 CPU seconds
INFO: [Project 1-479] Netlist was created with Vivado 2019.1
INFO: [Project 1-570] Preparing netlist for logic optimization
INFO: [Timing 38-478] Restoring timing data from binary archive.
INFO: [Timing 38-479] Binary timing data restore complete.
INFO: [Project 1-856] Restoring constraints from binary archive.
INFO: [Project 1-853] Binary constraint restore complete.
Reading XDEF placement.
Reading placer database...
Reading XDEF routing.
Read XDEF File: Time (s): cpu = 00:00:02 ; elapsed = 00:00:01 . Memory (MB): peak = 1219.953 ; gain = 6.953
Restored from archive | CPU: 2.000000 secs | Memory: 0.000000 MB |
Finished XDEF File Restore: Time (s): cpu = 00:00:02 ; elapsed = 00:00:01 . Memory (MB): peak = 1219.953 ; gain = 6.953
Netlist sorting complete. Time (s): cpu = 00:00:00 ; elapsed = 00:00:00.004 . Memory (MB): peak = 1219.953 ; gain = 0.000
INFO: [Project 1-111] Unisim Transformation Summary:
No Unisim elements were transformed.

INFO: [Project 1-604] Checkpoint was created with Vivado v2019.1 (64-bit) build 2552052
open_checkpoint: Time (s): cpu = 00:00:35 ; elapsed = 00:00:43 . Memory (MB): peak = 1219.953 ; gain = 921.383
Command: write_bitstream -force zynq_interrupt_system_3_gpios_wrapper.bit
Attempting to get a license for feature 'Implementation' and/or device 'xc7z010'
INFO: [Common 17-349] Got license for feature 'Implementation' and/or device 'xc7z010'
Running DRC as a precondition to command write_bitstream
INFO: [IP_Flow 19-234] Refreshing IP repositories
INFO: [IP_Flow 19-1704] No user IP repositories specified
INFO: [IP_Flow 19-2313] Loaded Vivado IP repository 'C:/Xilinx/Vivado/2019.1/data/ip'.
INFO: [DRC 23-27] Running DRC with 2 threads
INFO: [Vivado 12-3199] DRC finished with 0 Errors
INFO: [Vivado 12-3200] Please refer to the DRC report (report_drc) for more information.
INFO: [Designutils 20-2272] Running write_bitstream with 2 threads.
Loading data files...
Loading site data...
Loading route data...
Processing options...
Creating bitmap...
Creating bitstream...
Writing bitstream ./zynq_interrupt_system_3_gpios_wrapper.bit...
INFO: [Vivado 12-1842] Bitgen Completed Successfully.
INFO: [Project 1-120] WebTalk data collection is mandatory when using a WebPACK part without a full Vivado license. To see the specific WebTalk data collected for your design, open the usage_statistics_webtalk.html or usage_statistics_webtalk.xml file in the implementation directory.
INFO: [Common 17-186] 'C:/Zynq_Book/axi_timer_and_interrupts/axi_timer_and_interrupts.runs/impl_1/usage_statistics_webtalk.xml' has been successfully sent to Xilinx on Wed Sep 23 22:25:55 2020. For additional details about this file, please refer to the WebTalk help file at C:/Xilinx/Vivado/2019.1/doc/webtalk_introduction.html.
INFO: [Common 17-83] Releasing license: Implementation
23 Infos, 0 Warnings, 0 Critical Warnings and 0 Errors encountered.
write_bitstream completed successfully
write_bitstream: Time (s): cpu = 00:00:34 ; elapsed = 00:00:45 . Memory (MB): peak = 1671.027 ; gain = 451.074
INFO: [Common 17-206] Exiting Vivado at Wed Sep 23 22:25:56 2020...
